Rank;Title;Genre1;Genre2;Genre3;Description;Director;Actors1;Actors1cod;Actors1peso;Actors2;Actors2cod;Actors2peso;Actors3;Actors3cod;Actors3peso;Actors4;Actors4cod;Actors4peso;somapeso;Year;Runtime (Minutes);Rating;Votes;Revenue (Millions);Metascore
706;The Neighbor;Crime;Horror;Thriller;Set in Cutter Mississippi, the film follows a man who discovers the dark truth about his neighbor and the secrets he may be keeping in the cellar.;Marcus Dunstan;JoshStewart;643;1;BillEngvall;156;1;AlexEssoe;38;1;RonnieGeneBlevins;1511;2;5;2016;87;5.8;4754;;60
707;The Adjustment Bureau;Romance;Sci-Fi;Thriller;The affair between a politician and a contemporary dancer is affected by mysterious forces keeping the lovers apart.;George Nolfi;MattDamon;1947;10;EmilyBlunt;1900;8;LisaThoreson;774;1;FlorenceKastriner;420;1;20;2011;106;7.1;208632;62.45;
708;The Hollars;Comedy;Drama;Romance;A man returns to his small hometown after learning that his mother has fallen ill and is about to undergo surgery.;John Krasinski;SharltoCopley;1937;9;CharlieDay;1707;4;RichardJenkins;1816;5;AnnaKendrick;1951;11;29;2016;88;6.5;5908;1.02;53
709;The Judge;Crime;Drama;;Big-city lawyer Hank Palmer returns to his childhood home where his father, the town's judge, is suspected of murder. Hank sets out to discover the truth and, along the way, reconnects with his estranged family.;David Dobkin;RobertDowneyJr.;1963;12;RobertDuvall;1505;2;VeraFarmiga;1872;6;BillyBobThornton;1317;2;22;2014;141;7.4;146812;47.11;48
710;Closed Circuit;Crime;Drama;Mystery;A high-profile terrorism case unexpectedly binds together two ex-lovers on the defense team - testing the limits of their loyalties and placing their lives in jeopardy.;John Crowley;EricBana;1793;5;RebeccaHall;1864;6;JimBroadbent;1612;3;CiaránHinds;1709;4;18;2013;96;6.2;18437;5.73;50
711;Transformers: Revenge of the Fallen;Action;Adventure;Sci-Fi;Sam Witwicky leaves the Autobots behind for a normal life. But when his mind is filled with cryptic symbols, the Decepticons target him and he is dragged back into the Transformers' war.;Michael Bay;ShiaLaBeouf;1959;11;MeganFox;1809;5;JoshDuhamel;1799;5;TyreseGibson;1770;4;25;2009;150;6;335757;402.08;35
712;La tortue rouge;Animation;Fantasy;;A man is shipwrecked on a deserted island and encounters a red turtle, which changes his life.;Michael Dudok de Wit;EmmanuelGarijo;399;1;TomHudson;1234;1;BaptisteGoy;139;1;AxelDevillers;133;1;4;2016;80;7.6;11482;0.92;86
713;The Book of Life;Animation;Adventure;Comedy;Manolo, a young man who is torn between fulfilling the expectations of his family and following his heart, embarks on an adventure that spans three fantastic worlds where he must face his greatest fears.;Jorge R. Gutiérrez;DiegoLuna;1712;4;ZoeSaldana;1874;6;ChanningTatum;1954;11;RonPerlman;1817;5;26;2014;95;7.3;50388;50.15;67
714;Incendies;Drama;Mystery;War;Twins journey to the Middle East to discover their family history, and fulfill their mother's last wishes.;Denis Villeneuve;LubnaAzabal;785;1;MélissaDésormeaux-Poulin;801;1;MaximGaudette;856;1;MustafaKamel;915;1;4;2010;131;8.2;92863;6.86;80
715;The Heartbreak Kid;Comedy;Romance;;A newly wed man who believes he's just gotten hitched to the perfect woman encounters another lady on his honeymoon.;Bobby Farrelly;BenStiller;1779;5;MichelleMonaghan;1911;8;MalinAkerman;1746;4;JerryStiller;576;1;18;2007;116;5.8;74664;36.77;46
716;Happy Feet;Animation;Comedy;Family;Into the world of the Emperor Penguins, who find their soul mates through song, a penguin is born who cannot sing. But he can tap dance something fierce!;George Miller;ElijahWood;1357;2;BrittanyMurphy;195;1;HughJackman;1968;14;RobinWilliams;1508;2;19;2006;108;6.5;141141;197.99;77
717;Entourage;Comedy;;;Movie star Vincent Chase, together with his boys Eric, Turtle, and Johnny, are back - and back in business with super agent-turned-studio head Ari Gold on a risky project that will serve as Vince's directorial debut.;Doug Ellin;AdrianGrenier;1290;2;KevinConnolly;714;1;JerryFerrara;574;1;KevinDillon;715;1;5;2015;104;6.6;64557;32.36;38
718;The Strangers;Horror;Mystery;Thriller;A young couple staying in an isolated vacation home are terrorized by three unknown assailants.;Bryan Bertino;ScottSpeedman;1116;1;LivTyler;1639;3;GemmaWard;450;1;AlexFisher;39;1;6;2008;86;6.2;96718;52.53;47
719;Noah;Action;Adventure;Drama;A man is chosen by his world's creator to undertake a momentous mission before an apocalyptic flood cleanses the world.;Darren Aronofsky;RussellCrowe;1891;7;JenniferConnelly;1736;4;AnthonyHopkins;1777;5;EmmaWatson;1901;8;24;2014;138;5.8;209700;101.16;68
720;Neighbors;Comedy;;;After they are forced to live next to a fraternity house, a couple with a newborn baby do whatever they can to take them down.;Nicholas Stoller;SethRogen;1958;11;RoseByrne;1935;9;ZacEfron;1919;8;LisaKudrow;1442;2;30;2014;97;6.4;236500;150.06;68
721;Nymphomaniac: Vol. II;Drama;;;The continuation of Joe's sexually dictated life delves into the darker aspects of her adulthood, obsessions and what led to her being in Seligman's care.;Lars von Trier;CharlotteGainsbourg;1835;6;StellanSkarsgård;1822;5;WillemDafoe;1873;6;JamieBell;1880;7;24;2013;123;6.7;65824;0.33;60
722;Wild;Adventure;Biography;Drama;A chronicle of one woman's 1,100-mile solo hike undertaken as a way to recover from a recent personal tragedy.;Jean-Marc Vallée;ReeseWitherspoon;1759;4;LauraDern;1635;3;GabyHoffmann;440;1;MichielHuisman;1653;3;11;2014;115;7.1;95553;37.88;76
723;Grown Ups;Comedy;;;After their high school basketball coach passes away, five good friends and former teammates reunite for a Fourth of July holiday weekend.;Dennis Dugan;AdamSandler;1899;8;SalmaHayek;1517;2;KevinJames;1741;4;ChrisRock;1329;2;16;2010;102;6;190385;162;30
724;Blair Witch;Horror;Thriller;;After discovering a video showing what he believes to be his vanished sister Heather, James and a group of friends head to the forest believed to be inhabited by the Blair Witch.;Adam Wingard;JamesAllenMcCune;529;1;CallieHernandez;205;1;CorbinReid;276;1;BrandonScott;173;1;4;2016;89;5.1;26088;20.75;47
725;The Karate Kid;Action;Drama;Family;Work causes a single mother to move to China with her young son;;;0;0;;0;0;;0;0;;0;0;0;;;;;;
726;Dark Shadows;Comedy;Fantasy;Horror;An imprisoned vampire, Barnabas Collins, is set free and returns to his ancestral home, where his dysfunctional descendants are in need of his protection.;Tim Burton;JohnnyDepp;1961;12;MichellePfeiffer;1651;3;EvaGreen;1718;4;HelenaBonhamCarter;1842;6;25;2012;113;6.2;209326;79.71;55
727;Friends with Benefits;Comedy;Romance;;A young man and woman decide to take their friendship to the next level without becoming a couple, but soon discover that adding sex only leads to complications.;Will Gluck;MilaKunis;1912;8;JustinTimberlake;1739;4;PatriciaClarkson;1488;2;JennaElfman;566;1;15;2011;109;6.6;286543;55.8;63
728;The Illusionist;Drama;Mystery;Romance;In turn-of-the-century Vienna, a magician uses his abilities to secure the love of a woman far above his social standing.;Neil Burger;EdwardNorton;1791;5;JessicaBiel;1610;3;PaulGiamatti;1665;3;RufusSewell;1068;1;12;2006;110;7.6;309934;39.83;68
729;The A-Team;Action;Adventure;Comedy;A group of Iraq War veterans looks to clear their name with the U.S. military, who suspect the four men of committing a crime for which they were framed.;Joe Carnahan;LiamNeeson;1946;10;BradleyCooper;1952;11;SharltoCopley;1937;9;JessicaBiel;1610;3;33;2010;117;6.8;219116;77.21;47
730;The Guest;Thriller;;;A soldier introduces himself to the Peterson family, claiming to be a friend of their son who died in action. After the young man is welcomed into their home, a series of accidental deaths seem to be connected to his presence.;Adam Wingard;DanStevens;1580;3;SheilaKelley;1140;1;MaikaMonroe;1641;3;JoelDavidMoore;598;1;8;2014;100;6.7;71069;0.32;76
731;The Internship;Comedy;;;Two salesmen whose careers have been torpedoed by the digital age find their way into a coveted internship at Google, where they must compete with a group of young, tech-savvy geniuses for a shot at employment.;Shawn Levy;VinceVaughn;1771;4;OwenWilson;1934;9;RoseByrne;1935;9;AasifMandvi;8;1;23;2013;119;6.3;166342;44.67;42
732;Paul;Adventure;Comedy;Sci-Fi;Two British comic-book geeks traveling across the U.S. encounter an alien outside Area 51.;Greg Mottola;SimonPegg;1894;7;NickFrost;1656;3;SethRogen;1958;11;MiaStallard;872;1;22;2011;104;7;201707;37.37;57
733;This Beautiful Fantastic;Comedy;Drama;Fantasy;A young woman who dreams of being a children's author makes an unlikely friendship with a cantankerous, rich old widower.;Simon Aboud;JessicaBrownFindlay;1403;2;AndrewScott;1776;5;JeremyIrvine;1401;2;TomWilkinson;1769;4;13;2016;100;6.9;688;;51
734;The Da Vinci Code;Mystery;Thriller;;A murder inside the Louvre and clues in Da Vinci paintings lead to the discovery of a religious mystery protected by a secret society for two thousand years -- which could shake the foundations of Christianity.;Ron Howard;TomHanks;1938;9;AudreyTautou;1313;2;JeanReno;556;1;IanMcKellen;1843;6;18;2006;149;6.6;338280;217.54;46
735;Mr. Church;Comedy;Drama;;"""Mr. Church"" tells the story of a unique friendship that develops when a little girl and her dying mother retain the services of a talented cook - Henry Joseph Church. What begins as a six month arrangement instead spans into fifteen years and creates a family bond that lasts forever.";Bruce Beresford;EddieMurphy;365;1;BrittRobertson;1705;4;NataschaMcElhone;925;1;XavierSamuel;1772;4;10;2016;104;7.7;16163;0.69;37
736;Hugo;Adventure;Drama;Family;In Paris in 1931, an orphan named Hugo Cabret who lives in the walls of a train station is wrapped up in a mystery involving his late father and an automaton.;Martin Scorsese;AsaButterfield;1702;4;ChloëGraceMoretz;1955;11;ChristopherLee;257;1;BenKingsley;1921;9;25;2011;126;7.5;259182;73.82;83
737;The Blackcoat's Daughter;Horror;Thriller;;Two girls must battle a mysterious evil force when they get left behind at their boarding school over winter break.;Oz Perkins;EmmaRoberts;1590;3;KiernanShipka;721;1;LaurenHolly;753;1;LucyBoynton;1448;2;7;2015;93;5.6;4155;0.02;68
738;Body of Lies;Action;Drama;Romance;A CIA agent on the ground in Jordan hunts down a powerful terrorist leader while being caught between the unclear intentions of his American supervisors and Jordan Intelligence.;Ridley Scott;LeonardoDiCaprio;1945;10;RussellCrowe;1891;7;MarkStrong;1910;8;GolshiftehFarahani;1374;2;27;2008;128;7.1;182305;39.38;57
739;Knight of Cups;Drama;Romance;;A writer indulging in all that Los Angeles and Las Vegas has to offer undertakes a search for love and self via a series of adventures with six different women.;Terrence Malick;ChristianBale;1967;13;CateBlanchett;1953;11;NataliePortman;1914;8;BrianDennehy;184;1;33;2015;118;5.7;17439;0.56;53
740;The Mummy: Tomb of the Dragon Emperor;Action;Adventure;Fantasy;In the Far East, Alex O'Connell, the son of famed mummy fighters Rick and Evy O'Connell, unearths the mummy of the first Emperor of Qin -- a shape-shifting entity cursed by a witch centuries ago.;Rob Cohen;BrendanFraser;177;1;JetLi;1611;3;MariaBello;1642;3;MichelleYeoh;1652;3;10;2008;112;5.2;124554;102.18;31
741;The Boss;Comedy;;;A titan of industry is sent to prison after she's caught insider trading. When she emerges ready to rebrand herself as America's latest sweetheart, not everyone she screwed over is so quick to forgive and forget.;Ben Falcone;MelissaMcCarthy;1748;4;KristenBell;1743;4;PeterDinklage;1490;2;EllaAnderson;385;1;11;2016;99;5.4;29642;63.03;40
742;Hands of Stone;Action;Biography;Drama;The legendary Roberto Duran and his equally legendary trainer Ray Arcel change each other's lives.;Jonathan Jakubowicz;EdgarRamírez;1790;5;UsherRaymond;1251;1;RobertDeNiro;1916;8;RubénBlades;1065;1;15;2016;111;6.6;8998;4.71;54
743;El secreto de sus ojos;Drama;Mystery;Romance;A retired legal counselor writes a novel hoping to find closure for one of his past unresolved homicide cases and for his unreciprocated love with his superior - both of which still haunt him decades later.;Juan José Campanella;RicardoDarín;1030;1;SoledadVillamil;1153;1;PabloRago;974;1;CarlaQuevedo;214;1;4;2009;129;8.2;144524;20.17;80
744;True Grit;Adventure;Drama;Western;A tough U.S. Marshal helps a stubborn teenager track down her father's murderer.;Ethan Coen;JeffBridges;1848;6;MattDamon;1947;10;HaileeSteinfeld;1841;6;JoshBrolin;1944;10;32;2010;110;7.6;254904;171.03;80
745;We Are Your Friends;Drama;Music;Romance;Caught between a forbidden romance and the expectations of his friends, aspiring DJ Cole Carter attempts to find the path in life that leads to fame and fortune.;Max Joseph;ZacEfron;1919;8;WesBentley;1549;2;EmilyRatajkowski;394;1;JonnyWeston;627;1;12;2015;96;6.2;25903;3.59;46
746;A Million Ways to Die in the West;Comedy;Romance;Western;As a cowardly farmer begins to fall for the mysterious new woman in town, he must put his new-found courage to the test when her husband, a notorious gun-slinger, announces his arrival.;Seth MacFarlane;SethMacFarlane;1763;4;CharlizeTheron;1940;10;LiamNeeson;1946;10;AmandaSeyfried;1828;6;30;2014;116;6.1;144779;42.62;44
747;Only for One Night;Thriller;;;A married womans husband with a perfect life cheats with her sister with extreme consequences befalling them all.;Chris Stokes;BrianWhite;189;1;KarruecheTran;681;1;AngeliquePereira;82;1;JessicaVanessaDeLeon;584;1;4;2016;86;4.6;313;;60
748;Rules Don't Apply;Comedy;Drama;Romance;The unconventional love story of an aspiring actress, her determined driver, and their boss, eccentric billionaire Howard Hughes.;Warren Beatty;LilyCollins;1637;3;HaleyBennett;1723;4;TaissaFarmiga;1197;1;SteveTom;1178;1;9;2016;127;5.7;3731;3.65;
749;Ouija: Origin of Evil;Horror;Thriller;;In 1967 Los Angeles, a widowed mother and her 2 daughters add a new stunt to bolster their seance scam business, inviting an evil presence into their home.;Mike Flanagan;ElizabethReaser;384;1;LuluWilson;795;1;AnnaliseBasso;1305;2;HenryThomas;488;1;5;2016;99;6.1;30035;34.9;65
750;Percy Jackson: Sea of Monsters;Adventure;Family;Fantasy;In order to restore their dying safe haven, the son of Poseidon and his friends embark on a quest to the Sea of Monsters to find the mythical Golden Fleece while trying to stop an ancient evil from rising.;Thor Freudenthal;LoganLerman;1857;6;AlexandraDaddario;1557;3;BrandonT.Jackson;1322;2;NathanFillion;1478;2;13;2013;106;5.9;91684;68.56;39
751;Fracture;Crime;Drama;Mystery;An attorney, intent on climbing the career ladder toward success, finds an unlikely opponent in a manipulative criminal he is trying to prosecute.;Gregory Hoblit;AnthonyHopkins;1777;5;RyanGosling;1949;10;DavidStrathairn;1347;2;RosamundPike;1866;6;23;2007;113;7.2;148943;39;68
752;Oculus;Horror;Mystery;;A woman tries to exonerate her brother, who was convicted of murder, by proving that the crime was committed by a supernatural phenomenon.;Mike Flanagan;KarenGillan;675;1;BrentonThwaites;1570;3;KateeSackhoff;1420;2;RoryCochrane;1057;1;7;2013;104;6.5;92875;27.69;61
753;In Bruges;Comedy;Crime;Drama;Guilt-stricken after a job gone wrong, hitman Ray and his partner await orders from their ruthless boss in Bruges, Belgium, the last place in the world Ray wants to be.;Martin McDonagh;ColinFarrell;1837;6;BrendanGleeson;1832;6;CiaránHinds;1709;4;ElizabethBerrington;379;1;17;2008;107;7.9;322536;7.76;67
754;This Means War;Action;Comedy;Romance;Two top CIA operatives wage an epic battle against one another after they discover they are dating the same woman.;McG;ReeseWitherspoon;1759;4;ChrisPine;1924;9;TomHardy;1965;12;TilSchweiger;1224;1;26;2012;103;6.3;154400;54.76;31
755;Lída Baarová;Biography;Drama;History;A film about the black-and-white era actress Lída Baarová and her doomed love affair.;Filip Renc;TatianaPauhofová;1205;1;KarlMarkovics;679;1;GedeonBurkhard;448;1;SimonaStasová;1146;1;4;2016;106;5;353;;64
756;The Road;Adventure;Drama;;In a dangerous post-apocalyptic world, an ailing father defends his son as they slowly travel to the sea.;John Hillcoat;ViggoMortensen;1686;3;CharlizeTheron;1940;10;KodiSmit-McPhee;1633;3;RobertDuvall;1505;2;18;2009;111;7.3;187302;0.06;
757;Lavender;Drama;Thriller;;After losing her memory, a woman begins to see unexplained things after her psychiatrist suggests she visit her childhood home.;Ed Gass-Donnelly;AbbieCornish;1826;6;DermotMulroney;336;1;JustinLong;1624;3;DiegoKlattenhoff;340;1;11;2016;92;5.2;2083;;46
758;Deuces;Drama;;;An agent infiltrates a crime ring ran by a charismatic boss.;Jamal Hill;LarenzTate;741;1;MeaganGood;862;1;Rotimi;1064;1;RickGonzalez;1036;1;4;2016;87;6.6;256;;36
759;Conan the Barbarian;Action;Adventure;Fantasy;A vengeful barbarian warrior sets off to get his revenge on the evil warlord who attacked his village and murdered his father when he was a boy.;Marcus Nispel;JasonMomoa;1391;2;RonPerlman;1817;5;RoseMcGowan;1672;3;StephenLang;1526;2;12;2011;113;5.2;84893;21.27;
760;The Fighter;Action;Biography;Drama;"A look at the early years of boxer ""Irish"" Micky Ward and his brother who helped train him before going pro in the mid 1980s.";David O. Russell;MarkWahlberg;1969;15;ChristianBale;1967;13;AmyAdams;1920;9;MelissaLeo;1645;3;40;2010;116;7.8;290056;93.57;79
761;August Rush;Drama;Music;;A drama with fairy tale elements, where an orphaned musical prodigy uses his gift as a clue to finding his birth parents.;Kirsten Sheridan;FreddieHighmore;431;1;KeriRussell;1630;3;JonathanRhysMeyers;623;1;TerrenceHoward;1528;2;7;2007;114;7.5;91229;31.66;38
762;Chef;Comedy;Drama;;A head chef quits his restaurant job and buys a food truck in an effort to reclaim his creative promise, while piecing back together his estranged family.;Jon Favreau;JonFavreau;1620;3;RobertDowneyJr.;1963;12;ScarlettJohansson;1964;12;DustinHoffman;1713;4;31;2014;114;7.3;151970;31.24;68
763;Eye in the Sky;Drama;Thriller;War;Col. Katherine Powell, a military officer in command of an operation to capture terrorists in Kenya, sees her mission escalate when a girl enters the kill zone triggering an international dispute over the implications of modern warfare.;Gavin Hood;HelenMirren;1725;4;AaronPaul;1693;4;AlanRickman;1555;3;BarkhadAbdi;1314;2;13;2015;102;7.3;57826;18.7;73
764;Eagle Eye;Action;Mystery;Thriller;Jerry and Rachel are two strangers thrown together by a mysterious phone call from a woman they have never met. Threatening their lives and family, she pushes Jerry and Rachel into a series of increasingly dangerous situations, using the technology of everyday life to track and control their every move.;D.J. Caruso;ShiaLaBeouf;1959;11;MichelleMonaghan;1911;8;RosarioDawson;1867;6;MichaelChiklis;1466;2;27;2008;118;6.6;156158;101.11;43
765;The Purge;Horror;Sci-Fi;Thriller;A wealthy family are held hostage for harboring the target of a murderous syndicate during the Purge, a 12-hour period in which any and all crime is legal.;James DeMonaco;EthanHawke;1879;7;LenaHeadey;1805;5;MaxBurkholder;854;1;AdelaideKane;16;1;14;2013;85;5.7;154588;64.42;41
766;PK;Comedy;Drama;Romance;A stranger in the city asks questions no one has asked before. His childlike curiosity will take him on a journey of love, laughter, and letting go.;Rajkumar Hirani;AamirKhan;1691;4;AnushkaSharma;107;1;SanjayDutt;1095;1;BomanIrani;166;1;7;2014;153;8.2;103279;10.57;51
767;Ender's Game;Action;Sci-Fi;;Young Ender Wiggin is recruited by the International Military to lead the fight against the Formics, a genocidal alien race which nearly annihilated the human race in a previous invasion.;Gavin Hood;HarrisonFord;1724;4;AsaButterfield;1702;4;HaileeSteinfeld;1841;6;AbigailBreslin;1694;4;18;2013;114;6.7;194236;61.66;
768;Indiana Jones and the Kingdom of the Crystal Skull;Action;Adventure;Fantasy;"Famed archaeologist/adventurer Dr. Henry ""Indiana"" Jones is called back into action when he becomes entangled in a Soviet plot to uncover the secret behind mysterious artifacts known as the Crystal Skulls.";Steven Spielberg;HarrisonFord;1724;4;CateBlanchett;1953;11;ShiaLaBeouf;1959;11;KarenAllen;673;1;27;2008;122;6.2;351361;317.01;65
769;Paper Towns;Drama;Mystery;Romance;After an all night adventure, Quentin's life-long crush, Margo, disappears, leaving behind clues that Quentin and his friends follow on the journey of a lifetime.;Jake Schreier;NatWolff;1655;3;CaraDelevingne;212;1;AustinAbrams;130;1;JusticeSmith;664;1;6;2015;109;6.3;72515;31.99;56
770;High-Rise;Drama;;;Life for the residents of a tower block begins to run out of control.;Ben Wheatley;TomHiddleston;1767;4;JeremyIrons;1737;4;SiennaMiller;1820;5;LukeEvans;1449;2;15;2015;119;5.7;25928;0.34;65
771;Quantum of Solace;Action;Adventure;Thriller;James Bond descends into mystery as he tries to stop a mysterious organization from eliminating a country's most valuable resource. All the while, he still tries to seek revenge over the death of his love.;Marc Forster;DanielCraig;1838;6;OlgaKurylenko;1659;3;MathieuAmalric;1459;2;JudiDench;1738;4;15;2008;106;6.6;347798;168.37;58
772;The Assignment;Action;Crime;Thriller;After waking up and discovering that he has undergone gender reassignment surgery, an assassin seeks to find the doctor responsible.;Walter Hill;SigourneyWeaver;1821;5;MichelleRodriguez;1812;5;TonyShalhoub;1540;2;AnthonyLaPaglia;102;1;13;2016;95;4.5;2043;;34
773;How to Train Your Dragon;Animation;Action;Adventure;A hapless young Viking who aspires to hunt dragons becomes the unlikely friend of a young dragon himself, and learns there may be more to the creatures than he assumed.;Dean DeBlois;JayBaruchel;1735;4;GerardButler;1943;10;ChristopherMintz-Plasse;1708;4;CraigFerguson;1335;2;20;2010;98;8.1;523893;217.39;74
774;Lady in the Water;Drama;Fantasy;Mystery;Apartment building superintendent Cleveland Heep rescues what he thinks is a young woman from the pool he maintains. When he discovers that she is actually a character from a bedtime story who is trying to make the journey back to her home, he works with his tenants to protect his new friend from the creatures that are determined to keep her in our world.;M. Night Shyamalan;PaulGiamatti;1665;3;BryceDallasHoward;1833;6;JeffreyWright;1608;3;BobBalaban;1321;2;14;2006;110;5.6;82701;42.27;36
775;The Fountain;Drama;Sci-Fi;;As a modern-day scientist, Tommy is struggling with mortality, desperately searching for the medical breakthrough that will save the life of his cancer-stricken wife, Izzi.;Darren Aronofsky;HughJackman;1968;14;RachelWeisz;1915;8;SeanPatrickThomas;1121;1;EllenBurstyn;1359;2;25;2006;96;7.3;199193;10.14;51
776;Cars 2;Animation;Adventure;Comedy;Star race car Lightning McQueen and his pal Mater head overseas to compete in the World Grand Prix race. But the road to the championship becomes rocky as Mater gets caught up in an intriguing adventure of his own: international espionage.;John Lasseter;OwenWilson;1934;9;LarrytheCableGuy;1432;2;MichaelCaine;1860;6;EmilyMortimer;1589;3;20;2011;106;6.2;110490;191.45;57
777;31;Horror;Thriller;;Five carnival workers are kidnapped and held hostage in an abandoned, Hell-like compound where they are forced to participate in a violent game, the goal of which is to survive twelve hours against a gang of sadistic clowns.;Rob Zombie;MalcolmMcDowell;813;1;RichardBrake;1032;1;JeffDanielPhillips;558;1;SheriMoonZombie;1142;1;4;2016;102;5.1;10871;0.78;35
778;Final Girl;Action;Thriller;;A man teaches a young woman how to become a complete weapon. Later she is approached by a group of sadistic teens who kill blonde women for unknown reasons. The hunting season begins.;Tyler Shields;AbigailBreslin;1694;4;WesBentley;1549;2;LoganHuffman;776;1;AlexanderLudwig;36;1;8;2015;90;4.7;9026;;56
779;Chalk It Up;Comedy;;;When a super girly-girl is dumped by her boyfriend;;;0;0;;0;0;;0;0;;0;0;0;;;;;;
780;The Man Who Knew Infinity;Biography;Drama;;The story of the life and academic career of the pioneer Indian mathematician, Srinivasa Ramanujan, and his friendship with his mentor, Professor G.H. Hardy.;Matt Brown;DevPatel;1788;5;JeremyIrons;1737;4;MalcolmSinclair;814;1;RaghuvirJoshi;1017;1;11;2015;108;7.2;29912;3.86;
781;Unknown;Action;Mystery;Thriller;A man awakens from a coma, only to discover that someone has taken on his identity and that no one, (not even his wife), believes him. With the help of a young woman, he sets out to prove who he is.;Jaume Collet-Serra;LiamNeeson;1946;10;DianeKruger;1789;5;JanuaryJones;546;1;AidanQuinn;22;1;17;2011;113;6.9;218679;61.09;56
782;Self/less;Action;Mystery;Sci-Fi;A dying real estate mogul transfers his consciousness into a healthy young body, but soon finds that neither the procedure nor the company that performed it are quite what they seem.;Tarsem Singh;RyanReynolds;1892;7;NatalieMartinez;924;1;MatthewGoode;1461;2;BenKingsley;1921;9;19;2015;117;6.5;67196;12.28;34
783;Mr. Brooks;Crime;Drama;Thriller;A psychological thriller about a man who is sometimes controlled by his murder-and-mayhem-loving alter ego.;Bruce A. Evans;KevinCostner;1802;5;DemiMoore;330;1;WilliamHurt;1550;2;DaneCook;297;1;9;2007;120;7.3;128146;28.48;45
784;Tramps;Comedy;Romance;;A young man and woman find love in an unlikely place while carrying out a shady deal.;Adam Leon;CallumTurner;207;1;GraceVanPatten;465;1;MichalVondel;889;1;MikeBirbiglia;1473;2;5;2016;82;6.5;1031;;77
785;Before We Go;Comedy;Drama;Romance;Two strangers stuck in Manhattan for the night grow into each other's most trusted confidants when an evening of unexpected adventure forces them to confront their fears and take control of their lives.;Chris Evans;ChrisEvans;1923;9;AliceEve;1296;2;EmmaFitzpatrick;397;1;JohnCullum;609;1;13;2014;95;6.9;31370;0.04;31
786;Captain Phillips;Biography;Drama;Thriller;The true story of Captain Richard Phillips and the 2009 hijacking by Somali pirates of the U.S.-flagged MV Maersk Alabama, the first American cargo ship to be hijacked in two hundred years.;Paul Greengrass;TomHanks;1938;9;BarkhadAbdi;1314;2;BarkhadAbdirahman;141;1;CatherineKeener;1572;3;15;2013;134;7.8;346154;107.1;83
