Rank;Title;Genre1;Genre2;Genre3;Description;Director;Actors1;Actors1cod;Actors1peso;Actors2;Actors2cod;Actors2peso;Actors3;Actors3cod;Actors3peso;Actors4;Actors4cod;Actors4peso;somapeso;Year;Runtime (Minutes);Rating;Votes;Revenue (Millions);Metascore
235;The Huntsman: Winter's War;Action;Adventure;Drama;Eric and fellow warrior Sara, raised as members of ice Queen Freya's army, try to conceal their forbidden love as they fight to survive the wicked intentions of both Freya and her sister Ravenna.;Cedric Nicolas-Troyan;ChrisHemsworth;1941;10;JessicaChastain;1907;8;CharlizeTheron;1940;10;EmilyBlunt;1900;8;36;2016;114;6.1;66766;47.95;35
236;The Perks of Being a Wallflower;Drama;Romance;;An introvert freshman is taken under the wings of two seniors who welcome him to the real world.;Stephen Chbosky;LoganLerman;1857;6;EmmaWatson;1901;8;EzraMiller;1595;3;PaulRudd;1815;5;22;2012;102;8;377336;17.74;67
237;Jackie;Biography;Drama;History;Following the assassination of President John F. Kennedy, First Lady Jacqueline Kennedy fights through grief and trauma to regain her faith, console her children, and define her husband's historic legacy.;Pablo Larraín;NataliePortman;1914;8;PeterSarsgaard;1755;4;GretaGerwig;1375;2;BillyCrudup;1569;3;17;2016;100;6.8;41446;13.96;81
238;The Disappointments Room;Drama;Horror;Thriller;A mother and her young son release unimaginable horrors from the attic of their rural dream home.;D.J. Caruso;KateBeckinsale;1854;6;MelRaido;869;1;DuncanJoiner;360;1;LucasTill;1447;2;10;2016;85;3.9;4895;2.41;31
239;The Grand Budapest Hotel;Adventure;Comedy;Drama;The adventures of Gustave H, a legendary concierge at a famous hotel from the fictional Republic of Zubrowka between the first and second World Wars, and Zero Moustafa, the lobby boy who becomes his most trusted friend.;Wes Anderson;RalphFiennes;1889;7;F.MurrayAbraham;411;1;MathieuAmalric;1459;2;AdrienBrody;1292;2;12;2014;99;8.1;530881;59.07;88
240;The Host;Action;Adventure;Romance;When an unseen enemy threatens mankind by taking over their bodies and erasing their memories, Melanie will risk everything to protect the people she cares most about, proving that love can conquer all in a dangerous new world.;Andrew Niccol;SaoirseRonan;1819;5;MaxIrons;857;1;JakeAbel;525;1;DianeKruger;1789;5;12;2013;125;5.9;96852;26.62;35
241;Fury;Action;Drama;War;A grizzled tank commander makes tough decisions as he and his crew fight their way across Germany in April, 1945.;David Ayer;BradPitt;1966;13;ShiaLaBeouf;1959;11;LoganLerman;1857;6;MichaelPeña;1811;5;35;2014;134;7.6;332234;85.71;64
242;Inside Out;Animation;Adventure;Comedy;After young Riley is uprooted from her Midwest life and moved to San Francisco, her emotions - Joy, Fear, Anger, Disgust and Sadness - conflict on how best to navigate a new city, house, and school.;Pete Docter;AmyPoehler;1299;2;BillHader;1566;3;LewisBlack;1437;2;MindyKaling;893;1;8;2015;95;8.2;416689;356.45;94
243;Rock Dog;Animation;Adventure;Comedy;When a radio falls from the sky into the hands of a wide-eyed Tibetan Mastiff, he leaves home to fulfill his dream of becoming a musician, setting into motion a series of completely unexpected events.;Ash Brannon;LukeWilson;1450;2;EddieIzzard;363;1;J.K.Simmons;1796;5;LewisBlack;1437;2;10;2016;90;5.8;1109;9.4;48
244;Terminator Genisys;Action;Adventure;Sci-Fi;When John Connor, leader of the human resistance, sends Sgt. Kyle Reese back to 1984 to protect Sarah Connor and safeguard the future, an unexpected turn of events creates a fractured timeline.;Alan Taylor;ArnoldSchwarzenegger;1310;2;JasonClarke;1845;6;EmiliaClarke;1361;2;JaiCourtney;1731;4;14;2015;126;6.5;205365;89.73;38
245;Percy Jackson & the Olympians: The Lightning Thief;Adventure;Family;Fantasy;A teenager discovers he's the descendant of a Greek god and sets out on an adventure to settle an on-going battle between the gods.;Chris Columbus;LoganLerman;1857;6;KevinMcKidd;718;1;SteveCoogan;1170;1;BrandonT.Jackson;1322;2;10;2010;118;5.9;148949;88.76;47
246;Les Misérables;Drama;Musical;Romance;In 19th-century France, Jean Valjean, who for decades has been hunted by the ruthless policeman Javert after breaking parole, agrees to care for a factory worker's daughter. The decision changes their lives forever.;Tom Hooper;HughJackman;1968;14;RussellCrowe;1891;7;AnneHathaway;1960;12;AmandaSeyfried;1828;6;39;2012;158;7.6;257426;148.78;63
247;Children of Men;Drama;Sci-Fi;Thriller;In 2027, in a chaotic world in which women have become somehow infertile, a former activist agrees to help transport a miraculously pregnant woman to a sanctuary at sea.;Alfonso Cuarón;JulianneMoore;1800;5;CliveOwen;1575;3;ChiwetelEjiofor;1922;9;MichaelCaine;1860;6;23;2006;109;7.9;382910;35.29;84
248;20th Century Women;Comedy;Drama;;The story of a teenage boy, his mother, and two other women who help raise him among the love and freedom of Southern California of 1979.;Mike Mills;AnnetteBening;96;1;ElleFanning;1840;6;GretaGerwig;1375;2;BillyCrudup;1569;3;12;2016;119;7.4;14708;5.66;83
249;Spy;Action;Comedy;Crime;A desk-bound CIA analyst volunteers to go undercover to infiltrate the world of a deadly arms dealer, and prevent diabolical global disaster.;Paul Feig;MelissaMcCarthy;1748;4;RoseByrne;1935;9;JudeLaw;1853;6;JasonStatham;1846;6;25;2015;119;7.1;188017;110.82;75
250;The Intouchables;Biography;Comedy;Drama;After he becomes a quadriplegic from a paragliding accident, an aristocrat hires a young man from the projects to be his caregiver.;Olivier Nakache;FrançoisCluzet;422;1;OmarSy;968;1;AnneLeNy;95;1;AudreyFleurot;127;1;4;2011;112;8.6;557965;13.18;57
251;Bonjour Anne;Comedy;Drama;Romance;Anne is at a crossroads in her life. Long married to a successful, driven but inattentive movie producer, she unexpectedly finds herself taking a car trip from Cannes to Paris with a ... See full summary »;Eleanor Coppola;DianeLane;1351;2;AlecBaldwin;1696;4;ArnaudViard;116;1;LindaGegusch;771;1;8;2016;92;4.9;178;0.32;50
252;Kynodontas;Drama;Thriller;;Three teenagers live isolated, without leaving their house, because their over-protective parents say they can only leave when their dogtooth falls out.;Yorgos Lanthimos;ChristosStergioglou;261;1;MicheleValley;890;1;AngelikiPapoulia;81;1;HristosPassalis;491;1;4;2009;94;7.3;50946;0.11;73
253;Straight Outta Compton;Biography;Drama;History;The group NWA emerges from the mean streets of Compton in Los Angeles, California, in the mid-1980s and revolutionizes Hip Hop culture with their music and tales about life in the hood.;F. Gary Gray;O'SheaJacksonJr.;972;1;CoreyHawkins;277;1;JasonMitchell;554;1;NeilBrownJr.;933;1;4;2015;147;7.9;139831;161.03;72
254;The Amazing Spider-Man 2;Action;Adventure;Sci-Fi;When New York is put under siege by Oscorp, it is up to Spider-Man to save the city he swore to protect as well as his loved ones.;Marc Webb;AndrewGarfield;1829;6;EmmaStone;1942;10;JamieFoxx;1797;5;PaulGiamatti;1665;3;24;2014;142;6.7;342183;202.85;53
255;The Conjuring;Horror;Mystery;Thriller;Paranormal investigators Ed and Lorraine Warren work to help a family terrorized by a dark presence in their farmhouse.;James Wan;PatrickWilson;1887;7;VeraFarmiga;1872;6;RonLivingston;1056;1;LiliTaylor;767;1;15;2013;112;7.5;330305;137.39;68
256;The Hangover;Comedy;;;Three buddies wake up from a bachelor party in Las Vegas, with no memory of the previous night and the bachelor missing. They make their way around the city in order to find their friend before his wedding.;Todd Phillips;ZachGalifianakis;1774;4;BradleyCooper;1952;11;JustinBartha;1416;2;EdHelms;1588;3;20;2009;100;7.8;611563;277.31;73
257;Battleship;Action;Adventure;Sci-Fi;A fleet of ships is forced to do battle with an armada of unknown origins in order to discover and thwart their destructive goals.;Peter Berg;AlexanderSkarsgård;1697;4;BrooklynDecker;1324;2;LiamNeeson;1946;10;Rihanna;1501;2;18;2012;131;5.8;210349;65.17;41
258;Rise of the Planet of the Apes;Action;Drama;Sci-Fi;A substance, designed to help the brain repair itself, gives rise to a super-intelligent chimp who leads an ape uprising.;Rupert Wyatt;JamesFranco;1928;9;AndySerkis;1564;3;FreidaPinto;1369;2;KarinKonoval;678;1;15;2011;105;7.6;422290;176.74;68
259;Lights Out;Horror;;;Rebecca must unlock the terror behind her little brother's experiences that once tested her sanity, bringing her face to face with an entity attached to their mother.;David F. Sandberg;TeresaPalmer;1896;7;GabrielBateman;436;1;MariaBello;1642;3;BillyBurke;1318;2;13;2016;81;6.4;69823;67.24;58
260;Norman: The Moderate Rise and Tragic Fall of a New York Fixer;Drama;Thriller;;Norman Oppenheimer is a small time operator who befriends a young politician at a low point in his life. Three years later, when the politician becomes an influential world leader, Norman's life dramatically changes for better and worse.;Joseph Cedar;RichardGere;1669;3;LiorAshkenazi;773;1;MichaelSheen;1650;3;CharlotteGainsbourg;1835;6;13;2016;118;7.1;664;2.27;76
261;Birdman or (The Unexpected Virtue of Ignorance);Comedy;Drama;Romance;Illustrated upon the progress of his latest Broadway play, a former popular actor's struggle to cope with his current life as a wasted actor is shown.;Alejandro González Iñárritu;MichaelKeaton;1810;5;ZachGalifianakis;1774;4;EdwardNorton;1791;5;AndreaRiseborough;1562;3;17;2014;119;7.8;440299;42.34;88
262;Black Swan;Drama;Thriller;;"A committed dancer wins the lead role in a production of Tchaikovsky's ""Swan Lake"" only to find herself struggling to maintain her sanity.";Darren Aronofsky;NataliePortman;1914;8;MilaKunis;1912;8;VincentCassel;1824;5;WinonaRyder;1273;1;22;2010;108;8;581518;106.95;79
263;Dear White People;Comedy;Drama;;The lives of four black students at an Ivy League college.;Justin Simien;TylerJamesWilliams;1247;1;TessaThompson;1680;3;KyleGallner;1430;2;TeyonahParris;1215;1;7;2014;108;6.2;21715;4.4;79
264;Nymphomaniac: Vol. I;Drama;;;A self-diagnosed nymphomaniac recounts her erotic experiences to the man who saved her after a beating.;Lars von Trier;CharlotteGainsbourg;1835;6;StellanSkarsgård;1822;5;StacyMartin;1161;1;ShiaLaBeouf;1959;11;23;2013;117;7;90556;0.79;64
265;Teenage Mutant Ninja Turtles: Out of the Shadows;Action;Adventure;Comedy;After facing Shredder, who has joined forces with mad scientist Baxter Stockman and henchmen Bebop and Rocksteady to take over the world, the Turtles must confront an even greater nemesis: the notorious Krang.;Dave Green;MeganFox;1809;5;WillArnett;1688;3;TylerPerry;1542;2;LauraLinney;1636;3;13;2016;112;6;59312;0.54;40
266;Knock Knock;Drama;Horror;Thriller;A devoted father helps two stranded young women who knock on his door, but his kind gesture turns into a dangerous seduction and a deadly game of cat and mouse.;Eli Roth;KeanuReeves;1855;6;LorenzaIzzo;1445;2;AnadeArmas;1300;2;AaronBurns;1286;2;12;2015;99;4.9;53441;0.03;53
267;Dirty Grandpa;Comedy;;;Right before his wedding, an uptight guy is tricked into driving his grandfather, a lecherous former Army Lieutenant-Colonel, to Florida for spring break.;Dan Mazer;RobertDeNiro;1916;8;ZacEfron;1919;8;ZoeyDeutch;1875;6;AubreyPlaza;1312;2;24;2016;102;6;75137;35.54;18
268;Cloud Atlas;Drama;Sci-Fi;;An exploration of how the actions of individual lives impact one another in the past, present and future, as one soul is shaped from a killer into a hero, and an act of kindness ripples across centuries to inspire a revolution.;Tom Tykwer;TomHanks;1938;9;HalleBerry;1377;2;HughGrant;1380;2;HugoWeaving;1600;3;16;2012;172;7.5;298651;27.1;55
269;X-Men Origins: Wolverine;Action;Adventure;Sci-Fi;A look at Wolverine's early life, in particular his time with the government squad Team X and the impact it will have on his later years.;Gavin Hood;HughJackman;1968;14;LievSchreiber;1806;5;RyanReynolds;1892;7;DannyHuston;310;1;27;2009;107;6.7;388447;179.88;40
270;Satanic;Horror;;;Four friends on their way to Coachella stop off in Los Angeles to tour true-crime occult sites, only to encounter a mysterious young runaway who puts them on a terrifying path to ultimate horror.;Jeffrey G. Hunt;SarahHyland;1102;1;StevenKrueger;1173;1;JustinChon;666;1;ClaraMamet;264;1;4;2016;85;3.7;2384;;
271;Skyfall;Action;Adventure;Thriller;Bond's loyalty to M is tested when her past comes back to haunt her. Whilst MI6 comes under attack, 007 must track down and destroy the threat, no matter how personal the cost.;Sam Mendes;DanielCraig;1838;6;JavierBardem;1847;6;NaomieHarris;922;1;JudiDench;1738;4;17;2012;143;7.8;547386;304.36;81
272;The Hobbit: An Unexpected Journey;Adventure;Fantasy;;A reluctant hobbit, Bilbo Baggins, sets out to the Lonely Mountain with a spirited group of dwarves to reclaim their mountain home - and the gold within it - from the dragon Smaug.;Peter Jackson;MartinFreeman;1858;6;IanMcKellen;1843;6;RichardArmitage;1668;3;AndySerkis;1564;3;18;2012;169;7.9;668651;303;58
273;21 Jump Street;Action;Comedy;Crime;A pair of underachieving cops are sent back to a local high school to blend in and bring down a synthetic drug ring.;Phil Lord;JonahHill;1931;9;ChanningTatum;1954;11;IceCube;1601;3;BrieLarson;1782;5;28;2012;110;7.2;432046;138.45;69
274;Sing Street;Comedy;Drama;Music;A boy growing up in Dublin during the 1980s escapes his strained family life by starting a band to impress the mysterious girl he likes.;John Carney;FerdiaWalsh-Peelo;415;1;AidanGillen;21;1;MariaDoyleKennedy;822;1;JackReynor;1384;2;5;2016;106;8;52144;3.23;79
275;Ballerina;Animation;Adventure;Comedy;An orphan girl dreams of becoming a ballerina and flees her rural Brittany for Paris, where she passes for someone else and accedes to the position of pupil at the Grand Opera house.;Eric Summer;ElleFanning;1840;6;DaneDeHaan;1337;2;CarlyRaeJepsen;215;1;MaddieZiegler;804;1;10;2016;89;6.8;4729;;
276;Oblivion;Action;Adventure;Mystery;A veteran assigned to extract Earth's remaining resources begins to question what he knows about his mission and himself.;Joseph Kosinski;TomCruise;1917;8;MorganFreeman;1913;8;AndreaRiseborough;1562;3;OlgaKurylenko;1659;3;22;2013;124;7;410125;89.02;54
277;22 Jump Street;Action;Comedy;Crime;After making their way through high school (twice), big changes are in store for officers Schmidt and Jenko when they go deep undercover at a local college.;Phil Lord;ChanningTatum;1954;11;JonahHill;1931;9;IceCube;1601;3;NickOfferman;1752;4;27;2014;112;7.1;280110;191.62;71
278;Zodiac;Crime;Drama;History;In the late 1960s/early 1970s, a San Francisco cartoonist becomes an amateur detective obsessed with tracking down the Zodiac Killer, an unidentified individual who terrorizes Northern California with a killing spree.;David Fincher;JakeGyllenhaal;1956;11;RobertDowneyJr.;1963;12;MarkRuffalo;1886;7;AnthonyEdwards;101;1;31;2007;157;7.7;329683;33.05;78
279;Everybody Wants Some!!;Comedy;;;In 1980, a group of college baseball players navigate their way through the freedoms and responsibilities of unsupervised adulthood.;Richard Linklater;BlakeJenner;1319;2;TylerHoechlin;1246;1;RyanGuzman;1514;2;ZoeyDeutch;1875;6;11;2016;117;7;36312;3.37;83
280;Iron Man Three;Action;Adventure;Sci-Fi;When Tony Stark's world is torn apart by a formidable terrorist called the Mandarin, he starts an odyssey of rebuilding and retribution.;Shane Black;RobertDowneyJr.;1963;12;GuyPearce;1721;4;GwynethPaltrow;1722;4;DonCheadle;1584;3;23;2013;130;7.2;591023;408.99;62
281;Now You See Me;Crime;Mystery;Thriller;An FBI agent and an Interpol detective track a team of illusionists who pull off bank heists during their performances and reward their audiences with the money.;Louis Leterrier;JesseEisenberg;1906;8;Common;274;1;MarkRuffalo;1886;7;WoodyHarrelson;1939;9;25;2013;115;7.3;492324;117.7;50
282;Sherlock Holmes;Action;Adventure;Crime;Detective Sherlock Holmes and his stalwart partner Watson engage in a battle of wits and brawn with a nemesis whose plot is a threat to all of England.;Guy Ritchie;RobertDowneyJr.;1963;12;JudeLaw;1853;6;RachelMcAdams;1888;7;MarkStrong;1910;8;33;2009;128;7.6;501769;209.02;57
283;Death Proof;Thriller;;;"Two separate sets of voluptuous women are stalked at different times by a scarred stuntman who uses his ""death proof"" cars to execute his murderous plans.";Quentin Tarantino;KurtRussell;1804;5;ZoëBell;1553;2;RosarioDawson;1867;6;VanessaFerlito;1254;1;14;2007;113;7.1;220236;;
284;The Danish Girl;Biography;Drama;Romance;A fictitious love story loosely inspired by the lives of Danish artists Lili Elbe and Gerda Wegener. Lili and Gerda's marriage and work evolve as they navigate Lili's groundbreaking journey as a transgender pioneer.;Tom Hooper;EddieRedmayne;1714;4;AliciaVikander;1827;6;AmberHeard;1561;3;BenWhishaw;1704;4;17;2015;119;7;110773;12.71;66
285;Hercules;Action;Adventure;;Having endured his legendary twelve labors, Hercules, the Greek demigod, has his life as a sword-for-hire tested when the King of Thrace and his daughter seek his aid in defeating a tyrannical warlord.;Brett Ratner;DwayneJohnson;1927;9;JohnHurt;1409;2;IanMcShane;1727;4;JosephFiennes;636;1;16;2014;98;6;122838;72.66;47
286;Sucker Punch;Action;Fantasy;;A young girl is institutionalized by her abusive stepfather, retreating to an alternative reality as a coping strategy, envisioning a plan to help her escape.;Zack Snyder;EmilyBrowning;1717;4;VanessaHudgens;1544;2;AbbieCornish;1826;6;JenaMalone;1396;2;14;2011;110;6.1;204874;36.38;33
287;Keeping Up with the Joneses;Action;Comedy;;A suburban couple becomes embroiled in an international espionage plot when they discover that their seemingly perfect new neighbors are government spies.;Greg Mottola;ZachGalifianakis;1774;4;IslaFisher;507;1;JonHamm;1621;3;GalGadot;1371;2;10;2016;105;5.8;30405;14.9;34
288;Jupiter Ascending;Action;Adventure;Sci-Fi;A young woman discovers her destiny as an heiress of intergalactic nobility and must fight to protect the inhabitants of Earth from an ancient and destructive industry.;Lana Wachowski;ChanningTatum;1954;11;MilaKunis;1912;8;EddieRedmayne;1714;4;SeanBean;1523;2;25;2015;127;5.3;150121;47.38;40
289;Masterminds;Action;Comedy;Crime;A guard at an armored car company in the Southern U.S. organizes one of the biggest bank heists in American history. Based on the October 1997 Loomis Fargo robbery.;Jared Hess;ZachGalifianakis;1774;4;KristenWiig;1884;7;OwenWilson;1934;9;RossKimball;1062;1;21;2016;95;5.8;26508;17.36;47
290;Iris;Thriller;;;Iris, young wife of a businessman, disappears in Paris. Maybe a mechanic with many debts is involved in the strange affair. A really complicated job for the police.;Jalil Lespert;RomainDuris;1053;1;CharlotteLeBon;1784;5;JalilLespert;527;1;CamilleCottin;209;1;8;2016;99;6.1;726;;
291;Busanhaeng;Action;Drama;Horror;While a zombie virus breaks out in South Korea, passengers struggle to survive on the train from Seoul to Busan.;Sang-ho Yeon;YooGong;1552;2;Soo-anKim;1155;1;Yu-miJung;1277;1;Dong-seokMa;348;1;5;2016;118;7.5;58782;2.13;72
292;Pitch Perfect;Comedy;Music;Romance;Beca, a freshman at Barden University, is cajoled into joining The Bellas, her school's all-girls singing group. Injecting some much needed energy into their repertoire, The Bellas take on their male rivals in a campus competition.;Jason Moore;AnnaKendrick;1951;11;BrittanySnow;1323;2;RebelWilson;1758;4;AnnaCamp;89;1;18;2012;112;7.2;226631;65;66
293;Neighbors 2: Sorority Rising;Comedy;;;When their new next-door neighbors turn out to be a sorority even more debaucherous than the fraternity previously living there, Mac and Kelly team with their former enemy, Teddy, to bring the girls down.;Nicholas Stoller;SethRogen;1958;11;RoseByrne;1935;9;ZacEfron;1919;8;ChloëGraceMoretz;1955;11;39;2016;92;5.7;76327;55.29;58
294;The Exception;Drama;;;A German soldier tries to determine if the Dutch resistance has planted a spy to infiltrate the home of Kaiser Wilhelm in Holland during the onset of World War II, but falls for a young Jewish Dutch woman during his investigation.;David Leveaux;LilyJames;1638;3;JaiCourtney;1731;4;ChristopherPlummer;1785;5;LoïsvanWijk;775;1;13;2016;107;7.7;96;;
295;Man of Steel;Action;Adventure;Fantasy;Clark Kent, one of the last of an extinguished race disguised as an unremarkable human, is forced to reveal his identity when Earth is invaded by an army of survivors who threaten to bring the planet to the brink of destruction.;Zack Snyder;HenryCavill;1726;4;AmyAdams;1920;9;MichaelShannon;1649;3;DianeLane;1351;2;18;2013;143;7.1;577010;291.02;55
296;The Choice;Drama;Romance;;Travis and Gabby first meet as neighbors in a small coastal town and wind up in a relationship that is tested by life's most defining events.;Ross Katz;BenjaminWalker;151;1;TeresaPalmer;1896;7;AlexandraDaddario;1557;3;MaggieGrace;1745;4;15;2016;111;6.6;20514;18.71;26
297;Ice Age: Collision Course;Animation;Adventure;Comedy;Manny, Diego, and Sid join up with Buck to fend off a meteor strike that would destroy the world.;Mike Thurmeier;RayRomano;1025;1;DenisLeary;331;1;JohnLeguizamo;1618;3;ChrisWedge;262;1;6;2016;94;5.7;34523;64.06;34
298;The Devil Wears Prada;Comedy;Drama;;A smart but sensible new graduate lands a job as an assistant to Miranda Priestly, the demanding editor-in-chief of a high fashion magazine.;David Frankel;AnneHathaway;1960;12;MerylStreep;1859;6;AdrianGrenier;1290;2;EmilyBlunt;1900;8;28;2006;109;6.8;302268;124.73;62
299;The Infiltrator;Biography;Crime;Drama;A U.S. Customs official uncovers a money laundering scheme involving Colombian drug lord Pablo Escobar.;Brad Furman;BryanCranston;1877;7;JohnLeguizamo;1618;3;DianeKruger;1789;5;AmyRyan;1699;4;19;2016;127;7.1;43929;15.43;66
300;There Will Be Blood;Drama;History;;A story of family, religion, hatred, oil and madness, focusing on a turn-of-the-century prospector in the early days of the business.;Paul Thomas Anderson;DanielDay-Lewis;1339;2;PaulDano;1664;3;CiaránHinds;1709;4;MartinStringer;839;1;10;2007;158;8.1;400682;40.22;92
301;The Equalizer;Action;Crime;Thriller;A man believes he has put his mysterious past behind him and has dedicated himself to beginning a new, quiet life. But when he meets a young girl under the control of ultra-violent Russian gangsters, he can't stand idly by - he has to help her.;Antoine Fuqua;DenzelWashington;1926;9;MartonCsokas;1456;2;ChloëGraceMoretz;1955;11;DavidHarbour;1344;2;24;2014;132;7.2;249425;101.53;57
302;Lone Survivor;Action;Biography;Drama;Marcus Luttrell and his team set out on a mission to capture or kill notorious Taliban leader Ahmad Shah, in late June 2005. Marcus and his team are left to fight for their lives in one of the most valiant efforts of modern warfare.;Peter Berg;MarkWahlberg;1969;15;TaylorKitsch;1678;3;EmileHirsch;1716;4;BenFoster;1831;6;28;2013;121;7.5;218996;125.07;60
303;The Cabin in the Woods;Horror;;;Five friends go for a break at a remote cabin, where they get more than they bargained for, discovering the truth behind the cabin in the woods.;Drew Goddard;KristenConnolly;729;1;ChrisHemsworth;1941;10;AnnaHutchison;1304;2;FranKranz;428;1;14;2012;95;7;295554;42.04;72
304;The House Bunny;Comedy;Romance;;After Playboy bunny Shelley is kicked out of the playboy mansion, she finds a job as the house mother for a sorority full of socially awkward girls.;Fred Wolf;AnnaFaris;1700;4;ColinHanks;268;1;EmmaStone;1942;10;KatDennings;682;1;16;2008;97;5.5;67033;48.24;55
305;She's Out of My League;Comedy;Romance;;An average Joe meets the perfect woman, but his lack of confidence and the influence of his friends and family begin to pick away at the relationship.;Jim Field Smith;JayBaruchel;1735;4;AliceEve;1296;2;T.J.Miller;1870;6;MikeVogel;1474;2;14;2010;104;6.4;105619;31.58;46
306;Inherent Vice;Comedy;Crime;Drama;"In 1970, drug-fueled Los Angeles private investigator Larry ""Doc"" Sportello investigates the disappearance of a former girlfriend.";Paul Thomas Anderson;JoaquinPhoenix;1615;3;JoshBrolin;1944;10;OwenWilson;1934;9;KatherineWaterston;1421;2;24;2014;148;6.7;69509;8.09;81
307;Alice Through the Looking Glass;Adventure;Family;Fantasy;Alice returns to the whimsical world of Wonderland and travels back in time to help the Mad Hatter.;James Bobin;MiaWasikowska;1749;4;JohnnyDepp;1961;12;HelenaBonhamCarter;1842;6;AnneHathaway;1960;12;34;2016;113;6.2;57207;77.04;34
308;Vincent N Roxxy;Crime;Drama;Thriller;A small town loner and a rebellious punk rocker unexpectedly fall in love as they are forced on the run and soon discover violence follows them everywhere.;Gary Michael Schultz;EmileHirsch;1716;4;ZoëKravitz;1554;2;ZoeyDeutch;1875;6;EmoryCohen;1592;3;15;2016;110;5.5;403;;
309;The Fast and the Furious: Tokyo Drift;Action;Crime;Thriller;A teenager becomes a major competitor in the world of drift racing after moving in with his father in Tokyo to avoid a jail sentence in America.;Justin Lin;LucasBlack;1446;2;ZacheryTyBryan;1282;1;ShadMoss;1129;1;DamienMarzette;293;1;5;2006;104;6;193479;62.49;45
310;How to Be Single;Comedy;Romance;;A group of young adults navigate love and relationships in New York City.;Christian Ditter;DakotaJohnson;1710;4;RebelWilson;1758;4;LeslieMann;1856;6;AlisonBrie;1698;4;18;2016;110;6.1;59886;46.81;51
311;The Blind Side;Biography;Drama;Sport;The story of Michael Oher, a homeless and traumatized boy who became an All American football player and first round NFL draft pick with the help of a caring woman and her family.;John Lee Hancock;QuintonAaron;1005;1;SandraBullock;1818;5;TimMcGraw;1227;1;JaeHead;1386;2;9;2009;129;7.7;237221;255.95;53
312;La vie d'Adèle;Drama;Romance;;Adèle's life is changed when she meets Emma, a young woman with blue hair, who will allow her to discover desire and to assert herself as a woman and as an adult. In front of others, Adèle grows, seeks herself, loses herself, and ultimately finds herself through love and loss.;Abdellatif Kechiche;LéaSeydoux;1634;3;AdèleExarchopoulos;1287;2;SalimKechiouche;1081;1;AurélienRecoing;129;1;7;2013;180;7.8;103150;2.2;88
